{
  "artifact_types": [
    "responsive composition source",
    "breakpoint and reflow contract",
    "spatial hierarchy map",
    "multi-width stress evidence"
  ],
  "capability_id": "capability:responsive-layout-and-spatial-composition",
  "execution": {
    "external": "none",
    "host_actions": [],
    "model_tools": [
      "read",
      "edit",
      "write"
    ],
    "mutation_scope": "authorized-workspace",
    "remote_write": false
  },
  "forbidden_actions": [
    "remote Git, merge, deploy, release, cloud mutation, or external-system write",
    "invent product facts, brand authority, copy claims, customer data, assets, evidence, or approval",
    "perform an adjacent capability or combine independent review with source repair",
    "treat static inspection, stale capture, or model self-report as current rendered evidence",
    "claim Phase 9 evaluation, Phase 10 approval, or release evidence that has not run"
  ],
  "hard_gates": [
    "Desktop and mobile endpoints are insufficient: the layout must survive intermediate widths, 200% zoom, long or localized content, overflow, and touch-target constraints without losing task order.",
    "Review, evidence acquisition, preflight, and preservation audit never imply source remediation or release authority."
  ],
  "id": "responsive-layout-and-spatial-composition",
  "inputs": [
    "A visual direction, content structure, device classes, breakpoints, and existing layout constraints."
  ],
  "outputs": [
    "responsive composition source",
    "breakpoint and reflow contract",
    "spatial hierarchy map",
    "multi-width stress evidence"
  ],
  "permission_identity": "workspace-write",
  "policy": {
    "coverage": [
      "information-hierarchy",
      "mobile",
      "tablet",
      "desktop",
      "intermediate-widths",
      "zoom",
      "overflow",
      "density",
      "touch-targets"
    ],
    "human_decision": false,
    "rendered_evidence": true,
    "review_source_separation": true
  },
  "responsibility": "Design and implement semantic information hierarchy, layout, density, grid, reflow, and content rhythm across supported viewports and zoom levels.",
  "schema_version": "2.0",
  "status": "evaluating",
  "statuses": [
    "passed",
    "needs-input",
    "blocked",
    "failed"
  ],
  "version": "0.1.0-v2-candidate"
}
